<?xml version="1.0" encoding="UTF-8"?>
<!DOCTYPE softpkg SYSTEM "softpkg.dtd">
<softpkg name="EventChannelPkg" version="0.1">
 <pkgtype>CORBA Component</pkgtype>
 <title>EventChannel</title>
 <author>
    <company>DOC group </company>
    <webpage href="http://www.cs.wustl.edu/~doc"/>
 </author>
 <description>Simple Event Channel</description>
  <dependency type="DSO" >
    <localfile name="libTAO.so"/>
  </dependency>
  <implementation id="EventChannel" >
    <os name="Linux" version="4,0,0,0" />
    <processor name="x86" />
    <compiler name="gcc" />
    <programminglanguage name="C++" />
    <propertyfile>
      <fileinarchive name="eventchannel.cpf"/>
    </propertyfile>
    <code type="DSO" >
      <fileinarchive name="libService.so"/>
      <entrypoint>createEventChannel</entrypoint>
    </code>
  </implementation>
  <implementation id="Supplier" >
    <os name="Linux" version="4,0,0,0" />
    <processor name="x86" />
    <compiler name="gcc" />
    <programminglanguage name="C++" />
    <code type="DSO">
      <fileinarchive name="libSupplier.so"/>
      <entrypoint>createSupplier</entrypoint>
    </code>
  </implementation>
  <implementation id="Consumer" >
    <os name="Linux" version="4,0,0,0" />
    <processor name="x86" />
    <compiler name="gcc" />
    <programminglanguage name="C++" />
    <code type="DSO" >
      <fileinarchive name="libConsumer.so"/>
      <entrypoint>createConsumer</entrypoint>
    </code>
  </implementation>
</softpkg>
